# DELETE FROM, DELETE WHERE.

statement ok
CREATE TABLE t (id INT NOT NULL, name TEXT NOT NULL)

statement ok
INSERT INTO t VALUES (1, 'a'), (2, 'b'), (3, 'c'), (4, 'd')

statement ok
DELETE FROM t WHERE id = 2

query IT rowsort
SELECT id, name FROM t
----
1
a
3
c
4
d

statement ok
DELETE FROM t WHERE id > 2

query I rowsort
SELECT id FROM t
----
1

statement ok
DELETE FROM t

query I rowsort
SELECT id FROM t
----

# 7.38.1 S4.2 — cleanup discipline: leave nothing behind.
statement ok
DROP TABLE IF EXISTS t CASCADE
