# DML coverage: v4.4 added UPDATE / DELETE. DROP TABLE remains
# unsupported (v4.x cold backlog). v7.13.0 unblocks
# `ALTER TABLE … ADD COLUMN`.

statement ok
CREATE TABLE t (id INT NOT NULL, name TEXT)

statement ok
INSERT INTO t VALUES (1, 'x')

statement ok
INSERT INTO t VALUES (2, 'z')

# v4.4: UPDATE now supported
statement ok
UPDATE t SET name = 'y' WHERE id = 1

query IT rowsort
SELECT id, name FROM t
----
1
y
2
z

# v4.4: DELETE now supported
statement ok
DELETE FROM t WHERE id = 1

query IT rowsort
SELECT id, name FROM t
----
2
z

statement error
DROP TABLE t

# v7.13.0 — ALTER TABLE ADD COLUMN is supported (mailrs round-5 G1).
statement ok
ALTER TABLE t ADD COLUMN extra INT
